{
  "id": "coeur-incassable",
  "resume_court": "La cible gagne un bonus de moral contre les effets mentaux négatifs et peut ignorer les ordres de blesser un allié.",
  "categorie_principale": "protection",
  "tags": [
    "bonus_chiffre",
    "jet_de_sauvegarde",
    "effet_mental",
    "charme_ou_coercition",
    "duree_prolongee"
  ],
  "roles_tactiques": [
    "combat",
    "social"
  ],
  "cible_typique": "allie",
  "type_degats": null,
  "condition_infligee": [],
  "preuves": {
    "type_degats": null,
    "condition_infligee": [],
    "cible_typique": "une créature"
  },
  "notes_ambiguite": null,
  "slug": "coeur-incassable",
  "version_prompt": "p1.4",
  "version_taxonomie": "taxonomie_v1",
  "modele": "eu.anthropic.claude-haiku-4-5-20251001-v1:0",
  "genere_le": "2026-07-30T13:13:01+00:00",
  "hash_source": "5b301c6658cf5903e24a6c20a148d28382c65e265f6f3fce7c8494016bdb1af4"
}
