{
  "id": "armure-de-sang",
  "resume_court": "Le sang du lanceur durcit au contact de l'air et améliore sa CA à chaque blessure perforante ou tranchante.",
  "categorie_principale": "protection",
  "tags": [
    "transformation_du_sujet",
    "bonus_chiffre",
    "duree_prolongee",
    "protection_defensive"
  ],
  "roles_tactiques": [
    "combat"
  ],
  "cible_typique": "soi",
  "type_degats": null,
  "condition_infligee": [],
  "preuves": {
    "type_degats": null,
    "condition_infligee": [],
    "cible_typique": "le lanceur de sorts"
  },
  "notes_ambiguite": null,
  "slug": "armure-de-sang",
  "version_prompt": "p1.4",
  "version_taxonomie": "taxonomie_v1",
  "modele": "eu.anthropic.claude-haiku-4-5-20251001-v1:0",
  "genere_le": "2026-07-30T13:11:10+00:00",
  "hash_source": "f0f852e631d778aa0b5e87572d54cab8f8c909be643987f347efe826e81d3e61"
}
