{
  "id": "blessure-sympathique",
  "resume_court": "Le lanceur transfère une partie de ses blessures à une créature ciblée pendant 1 heure par niveau.",
  "categorie_principale": "protection",
  "tags": [
    "jet_de_sauvegarde",
    "duree_prolongee",
    "resistance_a_la_magie"
  ],
  "roles_tactiques": [
    "combat"
  ],
  "cible_typique": "allie",
  "type_degats": null,
  "condition_infligee": [],
  "preuves": {
    "type_degats": null,
    "condition_infligee": [],
    "cible_typique": "1 créature"
  },
  "notes_ambiguite": "Le sort transfère des dégâts du lanceur vers la cible, ce qui en fait une forme de protection pour le lanceur mais une charge pour la cible. Classé en protection car l'effet principal est de réduire les dégâts subis par le lanceur. La cible est typiquement un allié consentant (esclave, serviteur) plutôt qu'un ennemi.",
  "slug": "blessure-sympathique",
  "version_prompt": "p1.4",
  "version_taxonomie": "taxonomie_v1",
  "modele": "eu.anthropic.claude-haiku-4-5-20251001-v1:0",
  "genere_le": "2026-07-30T13:11:53+00:00",
  "hash_source": "a78ce533d58190377dbe624af6c59e0f3e09ebeb1061d9e3384ed1f170b94c29"
}
