{
  "id": "blessure-grave-de-groupe",
  "resume_court": "L'énergie négative blesse les vivants dans une zone et soigne les morts-vivants.",
  "categorie_principale": "attaque_directe",
  "tags": [
    "degats_directs",
    "zone_d_effet",
    "jet_de_sauvegarde",
    "plusieurs_cibles",
    "resistance_a_la_magie"
  ],
  "roles_tactiques": [
    "combat"
  ],
  "cible_typique": "zone",
  "type_degats": "negatif",
  "condition_infligee": [],
  "preuves": {
    "type_degats": "énergie négative",
    "condition_infligee": [],
    "cible_typique": "1 créature/niveau, distantes de moins de 9 m les unes des autres"
  },
  "notes_ambiguite": null,
  "slug": "blessure-grave-de-groupe",
  "version_prompt": "p1.4",
  "version_taxonomie": "taxonomie_v1",
  "modele": "eu.anthropic.claude-haiku-4-5-20251001-v1:0",
  "genere_le": "2026-07-30T13:11:51+00:00",
  "hash_source": "727c729eab98db7bd941467f5288651758045d8bf5edb33ca678677e69ef05c2"
}
