{
  "id": "vision-de-folie",
  "resume_court": "Un sort d'illusion qui fonctionne comme cauchemar et permet de déclencher un second sort lors du réveil.",
  "categorie_principale": "illusion",
  "tags": [
    "illusion_visuelle_ou_sonore",
    "effet_mental",
    "jet_de_sauvegarde",
    "metamagie_ou_sort_cible",
    "duree_instantanee",
    "resistance_a_la_magie"
  ],
  "roles_tactiques": [
    "combat",
    "social"
  ],
  "cible_typique": "ennemi",
  "type_degats": null,
  "condition_infligee": [],
  "preuves": {
    "type_degats": null,
    "condition_infligee": [],
    "cible_typique": "une créature vivante"
  },
  "notes_ambiguite": "Le sort fonctionne « exactement comme le sort cauchemar » mais le texte fourni ne décrit pas les effets du cauchemar lui-même, seulement les modifications apportées par Vision de folie. Les conditions infligées par le cauchemar ne peuvent donc pas être extraites du texte fourni seul. La catégorie illusion et les tags reflètent la nature du sort décrite (fantasme, effet mental) et sa mécanique (métamagie permettant de chaîner un second sort).",
  "slug": "vision-de-folie",
  "version_prompt": "p1.4",
  "version_taxonomie": "taxonomie_v1",
  "modele": "eu.anthropic.claude-haiku-4-5-20251001-v1:0",
  "genere_le": "2026-07-30T13:26:13+00:00",
  "hash_source": "9cd07a09ef2d01a5836998fc731c75b55f7f4166bb0d4e953bfc1716415b0d21"
}
