{
  "id": "conduit-etrange",
  "resume_court": "Marque une créature pour servir de point d'origine à un sort de zone ultérieur du lanceur.",
  "categorie_principale": "utilitaire",
  "tags": [
    "transformation_du_sujet",
    "jet_de_sauvegarde",
    "duree_prolongee",
    "metamagie_ou_sort_cible"
  ],
  "roles_tactiques": [
    "combat"
  ],
  "cible_typique": "ennemi",
  "type_degats": null,
  "condition_infligee": [],
  "preuves": {
    "type_degats": null,
    "condition_infligee": [],
    "cible_typique": "cible: une créature"
  },
  "notes_ambiguite": "Le sort ne cause pas de dégâts directs mais transforme la cible en vecteur pour un autre sort. Classé en utilitaire plutôt qu'en attaque directe car l'effet réside dans la modification du ciblage d'un sort futur, non dans une agression immédiate. La catégorie pourrait aussi être controle_de_zone, mais le texte insiste sur la transformation de la cible elle-même (« enveloppe ») et son rôle de point d'origine.",
  "slug": "conduit-etrange",
  "version_prompt": "p1.4",
  "version_taxonomie": "taxonomie_v1",
  "modele": "eu.anthropic.claude-haiku-4-5-20251001-v1:0",
  "genere_le": "2026-07-30T13:13:13+00:00",
  "hash_source": "3450b7abb2bfda15538a06e11347638f7233d21f1a4f4152e454c59ff2ecf3f1"
}
