{
  "id": "crime-de-situation",
  "resume_court": "Le lanceur éveille une pulsion criminelle chez une créature pour 1 round.",
  "categorie_principale": "coercition",
  "tags": [
    "effet_mental",
    "jet_de_sauvegarde",
    "charme_ou_coercition",
    "duree_instantanee"
  ],
  "roles_tactiques": [
    "combat"
  ],
  "cible_typique": "ennemi",
  "type_degats": null,
  "condition_infligee": [],
  "preuves": {
    "type_degats": null,
    "condition_infligee": [],
    "cible_typique": "une créature"
  },
  "notes_ambiguite": "La durée est 1 round, ce qui est très court mais non instantané ; cependant, le texte ne décrit pas une condition persistante au sens des conditions listées. Le sort impose une compulsion comportementale plutôt qu'une condition mécanique nommée. Aucune condition de la liste ne s'applique précisément.",
  "slug": "crime-de-situation",
  "version_prompt": "p1.5",
  "version_taxonomie": "taxonomie_v2",
  "modele": "eu.anthropic.claude-haiku-4-5-20251001-v1:0",
  "genere_le": "2026-07-30T14:58:11+00:00",
  "hash_source": "06edebc8818534a4104b2eeb70484ae6ef0193d0bc5141440eddd4a98126f15a"
}
