{
  "id": "cecite-nocturne",
  "resume_court": "La vision nocturne de la cible est réduite d'une catégorie et ses capacités de vision dans l'obscurité sont annulées.",
  "categorie_principale": "affaiblissement",
  "tags": [
    "perception_amelioree",
    "jet_de_sauvegarde",
    "duree_prolongee",
    "malus_chiffre"
  ],
  "roles_tactiques": [
    "combat",
    "exploration"
  ],
  "cible_typique": "ennemi",
  "type_degats": null,
  "condition_infligee": [],
  "preuves": {
    "type_degats": null,
    "condition_infligee": [],
    "cible_typique": "une créature vivante"
  },
  "notes_ambiguite": "Le sort dégrade les capacités sensorielles sans infliger une condition nommée de la liste standard. Il s'agit d'un affaiblissement de capacité plutôt qu'une condition discrète comme aveugle ou ébloui, bien que le texte mentionne ces dernières dans un contexte de résistance accrue.",
  "slug": "cecite-nocturne",
  "version_prompt": "p1.4",
  "version_taxonomie": "taxonomie_v1",
  "modele": "eu.anthropic.claude-haiku-4-5-20251001-v1:0",
  "genere_le": "2026-07-30T13:12:35+00:00",
  "hash_source": "8fcb0ec4aca488f74841a2c561252c61effe71de6ec3ca6710a9698c72cec82f"
}
