{
  "id": "ecuyer-spirituel",
  "resume_court": "Invoque un serviteur de force pure qui aide le lanceur et ses alliés sans pouvoir attaquer.",
  "categorie_principale": "invocation",
  "tags": [
    "invocation_ou_creation",
    "amelioration_de_capacite",
    "duree_prolongee"
  ],
  "roles_tactiques": [
    "combat",
    "utilitaire"
  ],
  "cible_typique": "soi",
  "type_degats": null,
  "condition_infligee": [],
  "preuves": {
    "type_degats": null,
    "condition_infligee": [],
    "cible_typique": "Ce sort fait apparaître un être constitué de force pure sur une case à portée"
  },
  "notes_ambiguite": null,
  "slug": "ecuyer-spirituel",
  "version_prompt": "p1.4",
  "version_taxonomie": "taxonomie_v1",
  "modele": "eu.anthropic.claude-haiku-4-5-20251001-v1:0",
  "genere_le": "2026-07-30T13:15:09+00:00",
  "hash_source": "8d6840da631c9af4534c9f01c7a2e793c068192b66d6ba063d0cbb7df5588a0d"
}
