{
  "id": "lanternes-macabres",
  "resume_court": "Crée jusqu'à quatre sphères de lumière vert pâle qui gênent la discrétion et renforcent les défenses contre les illusions.",
  "categorie_principale": "utilitaire",
  "tags": [
    "invocation_ou_creation",
    "zone_d_effet",
    "bonus_chiffre",
    "duree_prolongee"
  ],
  "roles_tactiques": [
    "exploration",
    "combat"
  ],
  "cible_typique": "zone",
  "type_degats": null,
  "condition_infligee": [],
  "preuves": {
    "type_degats": null,
    "condition_infligee": [],
    "cible_typique": "jusqu'à 4 lumières toutes situées dans une zone de 3 m de rayon"
  },
  "notes_ambiguite": "Le sort inflige un malus de -5 aux tests de Discrétion et confère un bonus de +2 aux jets de sauvegarde contre les illusions, mais ces effets ne sont pas des conditions infligées au sens strict : ce sont des modificateurs environnementaux. Le sort crée des objets lumineux plutôt que d'invoquer des créatures, d'où la classification en utilitaire avec le tag invocation_ou_creation.",
  "slug": "lanternes-macabres",
  "version_prompt": "p1.4",
  "version_taxonomie": "taxonomie_v1",
  "modele": "eu.anthropic.claude-haiku-4-5-20251001-v1:0",
  "genere_le": "2026-07-30T13:17:59+00:00",
  "hash_source": "22645c5e0d657e0caf8e426910e13d4495a5f941821ab0c0619a1f8a32ffc6e0"
}
