{
  "id": "malediction-de-negation-magique",
  "resume_court": "La cible subit une plaie magique de négation qui entrave sa capacité à utiliser la magie.",
  "categorie_principale": "affaiblissement",
  "tags": [
    "effet_mental",
    "jet_de_sauvegarde",
    "duree_prolongee",
    "malus_chiffre",
    "resistance_a_la_magie"
  ],
  "roles_tactiques": [
    "combat"
  ],
  "cible_typique": "ennemi",
  "type_degats": null,
  "condition_infligee": [],
  "preuves": {
    "type_degats": null,
    "condition_infligee": [],
    "cible_typique": "une créature"
  },
  "notes_ambiguite": "Le texte ne nomme pas explicitement une condition de la liste fermée (aveugle, étourdi, etc.). La « plaie magique de négation » est un effet mécanique qui dégrade la capacité magique de la cible, classé comme affaiblissement plutôt que comme une condition infligée au sens strict. Le malus de -5 aux tests de dissipation justifie le tag malus_chiffre.",
  "slug": "malediction-de-negation-magique",
  "version_prompt": "p1.4",
  "version_taxonomie": "taxonomie_v1",
  "modele": "eu.anthropic.claude-haiku-4-5-20251001-v1:0",
  "genere_le": "2026-07-30T13:18:28+00:00",
  "hash_source": "f2a4941cd8ed41aa549949ac0c6c2bb999af86ef73c7cd4e0c1c31bdff1a558a"
}
