{
  "id": "accompagnement-exquis",
  "resume_court": "Le lanceur crée un instrument fantomatique qui joue à sa demande sans consommer ses rounds de représentation bardique.",
  "categorie_principale": "invocation",
  "tags": [
    "invocation_ou_creation",
    "duree_prolongee",
    "amelioration_de_capacite"
  ],
  "roles_tactiques": [
    "combat",
    "utilitaire"
  ],
  "cible_typique": "soi",
  "type_degats": null,
  "condition_infligee": [],
  "preuves": {
    "type_degats": null,
    "condition_infligee": [],
    "cible_typique": "personnelle"
  },
  "notes_ambiguite": null,
  "slug": "accompagnement-exquis",
  "version_prompt": "p1.4",
  "version_taxonomie": "taxonomie_v1",
  "modele": "eu.anthropic.claude-haiku-4-5-20251001-v1:0",
  "genere_le": "2026-07-30T13:06:08+00:00",
  "hash_source": "ff96d2a8a6602b34ad4a02d3f529e8db48026ebea4fd43b0dfada00a969d74eb"
}
