{
  "id": "porte-bonheur",
  "resume_court": "Le lanceur rayonne la chance dans un rayon de 9 m, accordant +2 aux jets de sauvegarde et permettant aux alliés de relancer.",
  "categorie_principale": "amelioration",
  "tags": [
    "bonus_chiffre",
    "zone_d_effet",
    "amelioration_de_capacite",
    "duree_prolongee"
  ],
  "roles_tactiques": [
    "combat",
    "utilitaire"
  ],
  "cible_typique": "zone",
  "type_degats": null,
  "condition_infligee": [],
  "preuves": {
    "type_degats": null,
    "condition_infligee": [],
    "cible_typique": "un rayon de 9 mètres autour de lui"
  },
  "notes_ambiguite": "Le sort affecte principalement le lanceur (+2 aux jets de sauvegarde) mais crée aussi une zone bénéfique pour les alliés. La cible_typique « zone » reflète l'effet de rayonnement décrit, bien que le lanceur soit aussi bénéficiaire.",
  "slug": "porte-bonheur",
  "version_prompt": "p1.4",
  "version_taxonomie": "taxonomie_v1",
  "modele": "eu.anthropic.claude-haiku-4-5-20251001-v1:0",
  "genere_le": "2026-07-30T13:20:20+00:00",
  "hash_source": "8ed798973c7329e537f5e6ee53eab780cdfbeb9c826994b5607e76b5c9c36294"
}
