{
  "id": "arme-alignee-partage",
  "resume_court": "Confère l'alignement du lanceur à une ou plusieurs armes, la durée se divisant entre elles.",
  "categorie_principale": "amelioration",
  "tags": [
    "arme_ou_munition",
    "duree_prolongee",
    "transformation_du_sujet",
    "bonus_chiffre"
  ],
  "roles_tactiques": [
    "combat"
  ],
  "cible_typique": "objet",
  "type_degats": null,
  "condition_infligee": [],
  "preuves": {
    "type_degats": null,
    "condition_infligee": [],
    "cible_typique": "arme touchée ou 50 projectiles"
  },
  "notes_ambiguite": "Le texte renvoie à « arme alignée » sans en reproduire les effets complets. On suppose que ce sort améliore les armes en les dotant d'une propriété d'alignement (probablement magique), sans infliger de dégâts directs lui-même. La durée divisible et la transformation temporaire justifient les tags « duree_prolongee » et « transformation_du_sujet ».",
  "slug": "arme-alignee-partage",
  "version_prompt": "p1.4",
  "version_taxonomie": "taxonomie_v1",
  "modele": "eu.anthropic.claude-haiku-4-5-20251001-v1:0",
  "genere_le": "2026-07-30T13:11:01+00:00",
  "hash_source": "3adc4a232564e353ef0b286569b20ea6235929ea19c362537b7fb9b75f078f3b"
}
