{
  "id": "lame-spirituelle",
  "resume_court": "Le lanceur imprègne une arme d'énergie émotionnelle, lui conférant une propriété magique spectrale.",
  "categorie_principale": "amelioration",
  "tags": [
    "arme_ou_munition",
    "amelioration_de_capacite",
    "duree_prolongee",
    "transformation_du_sujet"
  ],
  "roles_tactiques": [
    "combat"
  ],
  "cible_typique": "objet",
  "type_degats": null,
  "condition_infligee": [],
  "preuves": {
    "type_degats": null,
    "condition_infligee": [],
    "cible_typique": "arme touchée"
  },
  "notes_ambiguite": null,
  "slug": "lame-spirituelle",
  "version_prompt": "p1.4",
  "version_taxonomie": "taxonomie_v1",
  "modele": "eu.anthropic.claude-haiku-4-5-20251001-v1:0",
  "genere_le": "2026-07-30T13:17:52+00:00",
  "hash_source": "8c9c13048cef8aea2f460c1c9b02e7ad5bdb7fc8e74e0d40bb581759e4bacf75"
}
