{
  "id": "resistance-aux-energies-destructives-partage",
  "resume_court": "Confère une résistance aux énergies destructives, partagée entre plusieurs créatures touchées.",
  "categorie_principale": "protection",
  "tags": [
    "protection_defensive",
    "duree_prolongee",
    "jet_de_sauvegarde",
    "amelioration_de_capacite"
  ],
  "roles_tactiques": [
    "combat",
    "exploration"
  ],
  "cible_typique": "allie",
  "type_degats": null,
  "condition_infligee": [],
  "preuves": {
    "type_degats": null,
    "condition_infligee": [],
    "cible_typique": "créatures touchées"
  },
  "notes_ambiguite": "Le texte renvoie à un sort de référence « résistance aux énergies destructives » sans en détailler les mécaniques. La catégorie et les tags reposent sur la description générale (protection, durée prolongée, jet de sauvegarde inoffensif) et sur le contexte d'un sort d'abjuration de niveau 3 destiné à améliorer les défenses.",
  "slug": "resistance-aux-energies-destructives-partage",
  "version_prompt": "p1.4",
  "version_taxonomie": "taxonomie_v1",
  "modele": "eu.anthropic.claude-haiku-4-5-20251001-v1:0",
  "genere_le": "2026-07-30T13:23:58+00:00",
  "hash_source": "44ca13f8844cf5b41f9126f85adf61c9df3046a3f05b61adcedc55d3cd5ce346"
}
