{
  "id": "effroi",
  "resume_court": "Le lanceur effraie une ou plusieurs créatures vivantes dans un rayon de 9 m.",
  "categorie_principale": "affaiblissement",
  "tags": [
    "effet_mental",
    "jet_de_sauvegarde",
    "plusieurs_cibles",
    "charme_ou_coercition"
  ],
  "roles_tactiques": [
    "combat"
  ],
  "cible_typique": "ennemi",
  "type_degats": null,
  "condition_infligee": [
    "effraye",
    "secoue"
  ],
  "preuves": {
    "type_degats": null,
    "condition_infligee": [
      "Les cibles de ce sort sont effrayées",
      "elle est seulement secouée pendant 1 round"
    ],
    "cible_typique": "1 créature vivante/3 niveaux, distantes de moins de 9 m (6 c) les unes des autres"
  },
  "notes_ambiguite": null,
  "slug": "effroi",
  "version_prompt": "p1.4",
  "version_taxonomie": "taxonomie_v1",
  "modele": "eu.anthropic.claude-haiku-4-5-20251001-v1:0",
  "genere_le": "2026-07-30T13:15:12+00:00",
  "hash_source": "ca876621e97a54f96ee0bf6de9b4f13d974135c4d38477657851d7eb25b036ca"
}
