{
  "id": "grappin-opportun",
  "resume_court": "Une corde se transforme en munition de grappin qui s'accroche à un objet et peut être rétractée.",
  "categorie_principale": "utilitaire",
  "tags": [
    "transformation_du_sujet",
    "objet_ou_equipement",
    "duree_prolongee",
    "arme_ou_munition"
  ],
  "roles_tactiques": [
    "exploration",
    "utilitaire"
  ],
  "cible_typique": "objet",
  "type_degats": null,
  "condition_infligee": [],
  "preuves": {
    "type_degats": null,
    "condition_infligee": [],
    "cible_typique": "un objet en forme de corde d'une longueur maximum de 15 m + 1,5 m/niveau"
  },
  "notes_ambiguite": null,
  "slug": "grappin-opportun",
  "version_prompt": "p1.4",
  "version_taxonomie": "taxonomie_v1",
  "modele": "eu.anthropic.claude-haiku-4-5-20251001-v1:0",
  "genere_le": "2026-07-30T13:16:57+00:00",
  "hash_source": "c45bf844162211bdf1d6f9d5a5daf040d1a961811ef9999255c544d04b9e2e55"
}
