{
  "id": "arret-du-temps",
  "resume_court": "Le lanceur agit pendant plusieurs rounds tandis que le reste du monde semble figé.",
  "categorie_principale": "amelioration",
  "tags": [
    "duree_prolongee",
    "amelioration_de_capacite",
    "invisibilite_ou_dissimulation"
  ],
  "roles_tactiques": [
    "combat",
    "exploration",
    "utilitaire"
  ],
  "cible_typique": "soi",
  "type_degats": null,
  "condition_infligee": [],
  "preuves": {
    "type_degats": null,
    "condition_infligee": [],
    "cible_typique": "le jeteur de sorts"
  },
  "notes_ambiguite": "Le sort améliore la capacité d'action du lanceur plutôt que de l'attaquer directement. Bien qu'il rend les autres créatures invulnérables aux attaques du lanceur, l'effet principal est une amélioration de sa propre vitesse perçue et de son invisibilité tactique, d'où la catégorie `amelioration` plutôt que `protection` ou `entrave`.",
  "slug": "arret-du-temps",
  "version_prompt": "p1.4",
  "version_taxonomie": "taxonomie_v1",
  "modele": "eu.anthropic.claude-haiku-4-5-20251001-v1:0",
  "genere_le": "2026-07-30T13:11:15+00:00",
  "hash_source": "f552ff83b872a45149cf266884322502e1b58d7b6a216501c5b59c38c38bd17e"
}
