{
  "id": "contrat-intermediaire",
  "resume_court": "Invoque jusqu'à 3 élémentaires ou Extérieurs (max 12 DV) qu'il faut convaincre individuellement.",
  "categorie_principale": "invocation",
  "tags": [
    "invocation_ou_creation",
    "jet_de_sauvegarde",
    "plusieurs_cibles",
    "duree_instantanee"
  ],
  "roles_tactiques": [
    "combat",
    "utilitaire"
  ],
  "cible_typique": "zone",
  "type_degats": null,
  "condition_infligee": [],
  "preuves": {
    "type_degats": null,
    "condition_infligee": [],
    "cible_typique": "jusqu'à 3 élémentaires ou Extérieurs (ne totalisant pas plus de 12 DV), apparaissant à 9 m (6 c) ou moins les uns des autres"
  },
  "notes_ambiguite": "Le sort invoque des créatures sans les contrôler directement : elles peuvent refuser et s'échapper. La cible est désignée comme un ensemble de créatures dans une zone, d'où le classement en « zone » plutôt qu'« ennemi ».",
  "slug": "contrat-intermediaire",
  "version_prompt": "p1.4",
  "version_taxonomie": "taxonomie_v1",
  "modele": "eu.anthropic.claude-haiku-4-5-20251001-v1:0",
  "genere_le": "2026-07-30T13:13:22+00:00",
  "hash_source": "374490d1c51d3285e6bcf1beacc3f378377bb9e18043e191bbe7eb77f4a865ac"
}
