{
  "id": "sphere-de-feu",
  "resume_court": "Une boule de feu qui roule et brûle les créatures qu'elle touche pendant plusieurs rounds.",
  "categorie_principale": "controle_de_zone",
  "tags": [
    "degats_directs",
    "zone_d_effet",
    "jet_de_sauvegarde",
    "terrain_ou_environnement",
    "duree_prolongee"
  ],
  "roles_tactiques": [
    "combat"
  ],
  "cible_typique": "zone",
  "type_degats": "feu",
  "condition_infligee": [],
  "preuves": {
    "type_degats": "3d6 points de dégâts de feu",
    "condition_infligee": [],
    "cible_typique": "sphère de 1,50 m (1 c) de diamètre"
  },
  "notes_ambiguite": null,
  "slug": "sphere-de-feu",
  "version_prompt": "p1.4",
  "version_taxonomie": "taxonomie_v1",
  "modele": "eu.anthropic.claude-haiku-4-5-20251001-v1:0",
  "genere_le": "2026-07-30T13:24:56+00:00",
  "hash_source": "275e7202b93fac52f5212a2d7a4bfdefc87940b04021463757622dbdf310d7a4"
}
