{
  "id": "marque-fantome",
  "resume_court": "Le lanceur lie un objet intangible au corps d'une créature consentante, qui peut le récupérer à volonté.",
  "categorie_principale": "amelioration",
  "tags": [
    "transformation_du_sujet",
    "duree_prolongee",
    "objet_ou_equipement",
    "invocation_ou_creation"
  ],
  "roles_tactiques": [
    "utilitaire",
    "exploration"
  ],
  "cible_typique": "allie",
  "type_degats": null,
  "condition_infligee": [],
  "preuves": {
    "type_degats": null,
    "condition_infligee": [],
    "cible_typique": "une créature consentante et un objet touché"
  },
  "notes_ambiguite": "Le sort inflige des dégâts (3d6 perforants et tranchants + 1d6 saignement) uniquement si dissipé alors que l'objet est dans le corps de la cible, ce qui est un effet secondaire conditionnel et non l'effet principal du sort. La catégorie principale reste amelioration car l'effet principal est de permettre à la créature de porter un objet intangible de manière sécurisée et pratique.",
  "slug": "marque-fantome",
  "version_prompt": "p1.4",
  "version_taxonomie": "taxonomie_v1",
  "modele": "eu.anthropic.claude-haiku-4-5-20251001-v1:0",
  "genere_le": "2026-07-30T13:18:42+00:00",
  "hash_source": "275f5588169eeda21c4f2d145eeed8a0e8f0152286df678e4d9490ede923e03b"
}
